{
  "schema": "openprose.configuration-explanation/1",
  "cwd": {
    "value": "/workspace",
    "source": { "kind": "default", "location": "process cwd" }
  },
  "projectConfigPath": null,
  "userConfigPath": "/workspace/config/openprose/cli.toml",
  "values": {
    "harness": { "value": "openprose", "source": { "kind": "default", "location": "built-in" } },
    "transport": { "value": "auto", "source": { "kind": "default", "location": "built-in" } },
    "model": { "value": null, "source": { "kind": "default", "location": "built-in" } },
    "timeout": { "value": "10m", "source": { "kind": "default", "location": "built-in" } },
    "output": { "value": "json", "source": { "kind": "flag", "location": "--output" } },
    "color": { "value": false, "source": { "kind": "default", "location": "built-in" } },
    "verbose": { "value": false, "source": { "kind": "default", "location": "built-in" } },
    "authProfile": { "value": null, "source": { "kind": "default", "location": "built-in" } }
  }
}
